query,before_retrieved_sources,after_retrieved_sources,changed
Как определить тело запроса с Pydantic?,"doc_03, doc_07, doc_01","doc_15, doc_03, doc_07",True
Как работать с вложенными моделями?,"doc_07, doc_02","doc_07, doc_02",False
Как использовать cookie-параметры?,doc_04,doc_04,False
Как создавать зависимости с yield?,doc_05,doc_05,False
Как объявлять обычные зависимости?,doc_06,"doc_17, doc_06",True
Как добавить дополнительные модели для документации?,"doc_07, doc_12","doc_07, doc_12",False
Как сделать первые шаги с FastAPI?,"doc_08, doc_05","doc_08, doc_05",False
Как обрабатывать ошибки в приложении?,"doc_12, doc_05, doc_09","doc_12, doc_05, doc_09",False
Как работать с header-параметрами?,"doc_10, doc_11, doc_03","doc_10, doc_11, doc_03",False
Как настраивать конфигурацию операций маршрута?,"doc_11, doc_12","doc_11, doc_12",False
Как использовать path-параметры?,"doc_12, doc_14","doc_12, doc_14",False
Как валидировать query-параметры и строки?,"doc_13, doc_14","doc_13, doc_14",False
Как использовать query-параметры?,doc_14,doc_14,False
Как определить модель ответа и тип возвращаемых данных?,"doc_07, doc_12, doc_03",doc_15,True
Как реализовать простую аутентификацию OAuth2 с паролем и Bearer?,doc_07,"doc_16, doc_15",True
Как использовать суб-зависимости?,doc_06,"doc_17, doc_06",True
